{"catalog_sha256":"e93a2e7f48c3f4d2f17977e5ecf0b01c1d5ffa241c4569ceeed20be7c1d1d736","comparison_directory_verifier_report_digest":"e6ef4c5d1f279ffa487072d298e63fb317230b7ac4b3be7caf75f611026d1d52","comparison_zip_verifier_report_digest":"e6ef4c5d1f279ffa487072d298e63fb317230b7ac4b3be7caf75f611026d1d52","compile_status":"not-run","created_at":"2026-07-16T11:12:06Z","expires_at":"2026-07-23T11:11:06Z","fork_dev_cutoff":"abce8ffe37d25cc8f189ae9e9a2a1e942279a5ad","generation_command":"macro-menu-build create-target-handoff","handoff_id":"handoff-b8d9d535604e78551423","kit_id":"kit-e93a2e7f48c3f4d2f179","manifest_digest":"d8fe08827f1babf7282e6177e6d2e9d8c9c6cdc1f201e86812e37504986f0522","manifest_sha256":"9ecb5f9d91317bf2076054433590bcee0b7661a62bf958df37ee6a0b1556508a","package_id":"core","prepared_record_id":"record.a-env-preparation.6802254","primary_directory_verifier_report_digest":"e6ef4c5d1f279ffa487072d298e63fb317230b7ac4b3be7caf75f611026d1d52","primary_zip_verifier_report_digest":"e6ef4c5d1f279ffa487072d298e63fb317230b7ac4b3be7caf75f611026d1d52","purpose":"discovery","reference_contract":{"approval":null,"contract_body_digest":"2be50e9acb278252d17d4f47e90c0487f4eee93a15cf8759a9004d5594338f3a","contract_id":"reference-contract-core","contract_version":1,"observations":null,"path_policy":{"allow_user_paths":false,"allowed_root_kinds":["catia-install","windows-install","system"]},"reference_definitions":[],"status":"discovery-required","transitions":null},"release_eligible":false,"review_record_id":"record.a-env-review.6802254","revocation_snapshot_sha256":"c2fd81b9af2d540218e502b2f6a64b63eaf10b7adc78eb82ce6afc0262017a96","revocation_status":"active","schema_version":1,"target":"CATIA R2018/VBA7 64","upstream_cutoff":"abce8ffe37d25cc8f189ae9e9a2a1e942279a5ad","work_branch":"codex/dev-review-report","work_commit":"68022541bf8cacd1db012128daf4cdef1048af8d","work_tree":"405f24751ddabecced9b547680e6dbdefdeb80be","zip_sha256":"d763b3e1a1a2e33d994a5c030e0fa3b541e8a46648f11378870c6a86711cf012","zip_sidecar_sha256":"74874056f58c75de184d832325578166fa5ccea5e2b40539dfc0cbf492148039"}
