{"catalog_sha256":"a09bfd3dcb7264c8bc0e35c32fc00b7bf95caa502aafb4d464e50efaa63b2a57","comparison_directory_verifier_report_digest":"e6ef4c5d1f279ffa487072d298e63fb317230b7ac4b3be7caf75f611026d1d52","comparison_zip_verifier_report_digest":"e6ef4c5d1f279ffa487072d298e63fb317230b7ac4b3be7caf75f611026d1d52","compile_status":"not-run","created_at":"2026-07-16T15:20:31Z","expires_at":"2026-07-23T15:19:09Z","fork_dev_cutoff":"abce8ffe37d25cc8f189ae9e9a2a1e942279a5ad","generation_command":"macro-menu-build create-target-handoff","handoff_id":"handoff-56097be57a37a63c7644","kit_id":"kit-a09bfd3dcb7264c8bc0e","manifest_digest":"d8fe08827f1babf7282e6177e6d2e9d8c9c6cdc1f201e86812e37504986f0522","manifest_sha256":"6d40a1f92f09aefde8e7397582ddf8092b876a2f71eebbb8131920aea76820f5","package_id":"core","prepared_record_id":"record.a-env-preparation.f2c9d8d","primary_directory_verifier_report_digest":"e6ef4c5d1f279ffa487072d298e63fb317230b7ac4b3be7caf75f611026d1d52","primary_zip_verifier_report_digest":"e6ef4c5d1f279ffa487072d298e63fb317230b7ac4b3be7caf75f611026d1d52","purpose":"discovery","reference_contract":{"approval":null,"contract_body_digest":"2be50e9acb278252d17d4f47e90c0487f4eee93a15cf8759a9004d5594338f3a","contract_id":"reference-contract-core","contract_version":1,"observations":null,"path_policy":{"allow_user_paths":false,"allowed_root_kinds":["catia-install","windows-install","system"]},"reference_definitions":[],"status":"discovery-required","transitions":null},"release_eligible":false,"review_record_id":"record.a-env-review.f2c9d8d","revocation_snapshot_sha256":"80523b67ad19794293dd8b860e028f4dc62e4396e7796b91df300921a142cca0","revocation_status":"active","schema_version":1,"target":"CATIA R2018/VBA7 64","upstream_cutoff":"abce8ffe37d25cc8f189ae9e9a2a1e942279a5ad","work_branch":"codex/dev-review-report","work_commit":"f2c9d8d8cd1e448444dd43aadb5e4fa57b5c86d0","work_tree":"6d9e36b85b5f8d1294c9934dff625497bc2441c9","zip_sha256":"87a0e4f283ee46d220a2e4d297f6de62a31c70a845af48ededacdab3723f8333","zip_sidecar_sha256":"57463baceb0c64dedc0970ed1c57ab0d21789527ccc4aa3ac9567ad79bbc2cab"}
