{"catalog_sha256":"d5ea863e68ba6af1cefabaa438422a7b581c6ab7930f7e3c2f027c4cd9407a6c","comparison_directory_verifier_report_digest":"e6ef4c5d1f279ffa487072d298e63fb317230b7ac4b3be7caf75f611026d1d52","comparison_zip_verifier_report_digest":"e6ef4c5d1f279ffa487072d298e63fb317230b7ac4b3be7caf75f611026d1d52","compile_status":"not-run","created_at":"2026-07-18T13:38:11Z","expires_at":"2026-07-25T12:38:11Z","fork_dev_cutoff":"abce8ffe37d25cc8f189ae9e9a2a1e942279a5ad","generation_command":"macro-menu-build create-target-handoff","handoff_id":"handoff-80d8cb2c06104fcf3c74","kit_id":"kit-d5ea863e68ba6af1cefa","manifest_digest":"d8fe08827f1babf7282e6177e6d2e9d8c9c6cdc1f201e86812e37504986f0522","manifest_sha256":"5bbfb3fa44e11ae36fb21175b2076d0e022c26837da3f683b716e2bba30705e9","package_id":"core","prepared_record_id":"record.a-env-preparation.0b28548","primary_directory_verifier_report_digest":"e6ef4c5d1f279ffa487072d298e63fb317230b7ac4b3be7caf75f611026d1d52","primary_zip_verifier_report_digest":"e6ef4c5d1f279ffa487072d298e63fb317230b7ac4b3be7caf75f611026d1d52","purpose":"discovery","reference_contract":{"approval":null,"contract_body_digest":"2be50e9acb278252d17d4f47e90c0487f4eee93a15cf8759a9004d5594338f3a","contract_id":"reference-contract-core","contract_version":1,"observations":null,"path_policy":{"allow_user_paths":false,"allowed_root_kinds":["catia-install","windows-install","system"]},"reference_definitions":[],"status":"discovery-required","transitions":null},"release_eligible":false,"review_record_id":"record.a-env-review.0b28548","revocation_snapshot_sha256":"1e992f6b67cc41d8bbb8f0d196febab781896a8378fb84bd514ba74ee199dff4","revocation_status":"active","schema_version":1,"target":"CATIA R2018/VBA7 64","upstream_cutoff":"abce8ffe37d25cc8f189ae9e9a2a1e942279a5ad","work_branch":"codex/dev-review-report","work_commit":"0b28548e5ebe1ee6f5c174122d56c92c2e6005ed","work_tree":"cbcac84169c75133fdb2de1b984ef62645edd5b7","zip_sha256":"db46b7c1e09741b71097554e9383356b90a1d77ef90fc3d910f1387344ade977","zip_sidecar_sha256":"c72da27158d0dcbf9399673781bedfff75a1fc0bcf3c383b00be08a12ad256ba"}
