{"catalog_sha256":"87ecc7bcf3d8f9deaf9916f0ae16e0c192db8044c32ffc569ce2385ad9247a21","comparison_directory_verifier_report_digest":"e6ef4c5d1f279ffa487072d298e63fb317230b7ac4b3be7caf75f611026d1d52","comparison_zip_verifier_report_digest":"e6ef4c5d1f279ffa487072d298e63fb317230b7ac4b3be7caf75f611026d1d52","compile_status":"not-run","created_at":"2026-07-16T15:52:15Z","expires_at":"2026-07-23T15:51:52Z","fork_dev_cutoff":"abce8ffe37d25cc8f189ae9e9a2a1e942279a5ad","generation_command":"macro-menu-build create-target-handoff","handoff_id":"handoff-07bbe55bc7552489cd55","kit_id":"kit-87ecc7bcf3d8f9deaf99","manifest_digest":"d8fe08827f1babf7282e6177e6d2e9d8c9c6cdc1f201e86812e37504986f0522","manifest_sha256":"4073b06d6fcf9d2787ff30b8b82e65f741df3bdb1f8a471d3b5123efb4019009","package_id":"core","prepared_record_id":"record-prepared-4327491","primary_directory_verifier_report_digest":"e6ef4c5d1f279ffa487072d298e63fb317230b7ac4b3be7caf75f611026d1d52","primary_zip_verifier_report_digest":"e6ef4c5d1f279ffa487072d298e63fb317230b7ac4b3be7caf75f611026d1d52","purpose":"discovery","reference_contract":{"approval":null,"contract_body_digest":"2be50e9acb278252d17d4f47e90c0487f4eee93a15cf8759a9004d5594338f3a","contract_id":"reference-contract-core","contract_version":1,"observations":null,"path_policy":{"allow_user_paths":false,"allowed_root_kinds":["catia-install","windows-install","system"]},"reference_definitions":[],"status":"discovery-required","transitions":null},"release_eligible":false,"review_record_id":"record-review-4327491","revocation_snapshot_sha256":"65670c6ba2759c4504b80ef8cb807cf4551e44db32d0ab342aedde279e9295ee","revocation_status":"active","schema_version":1,"target":"CATIA R2018/VBA7 64","upstream_cutoff":"abce8ffe37d25cc8f189ae9e9a2a1e942279a5ad","work_branch":"codex/dev-review-report","work_commit":"43274914149a67c3f076e5322e86060e3b1d1cc1","work_tree":"190494ac751fff8b51b925413f46b426f4e5eb25","zip_sha256":"165d044494a583cebf292e3e3df0f438cb4c3918d2d7ee7bb87055893d719af1","zip_sidecar_sha256":"4aec1bc19d4e61b6d26b91fc97b0a9c8ff7581901bf965faeb404eaca5efcd8b"}
