{"catalog_sha256":"256c8986f4a57bc0942f81c4b27538e370a556b7c6fdb35efa861d3e33df6a4d","comparison_directory_verifier_report_digest":"e6ef4c5d1f279ffa487072d298e63fb317230b7ac4b3be7caf75f611026d1d52","comparison_zip_verifier_report_digest":"e6ef4c5d1f279ffa487072d298e63fb317230b7ac4b3be7caf75f611026d1d52","compile_status":"not-run","created_at":"2026-07-18T15:59:00Z","expires_at":"2026-07-25T14:59:00Z","fork_dev_cutoff":"abce8ffe37d25cc8f189ae9e9a2a1e942279a5ad","generation_command":"macro-menu-build create-target-handoff","handoff_id":"handoff-bc6d14adc7f50224591e","kit_id":"kit-256c8986f4a57bc0942f","manifest_digest":"d8fe08827f1babf7282e6177e6d2e9d8c9c6cdc1f201e86812e37504986f0522","manifest_sha256":"478fec442cfc1068ff6a106b3bce0e1141d668c49fd8785c28e09d5581bf1eab","package_id":"core","prepared_record_id":"record-prepared-7477c28","primary_directory_verifier_report_digest":"e6ef4c5d1f279ffa487072d298e63fb317230b7ac4b3be7caf75f611026d1d52","primary_zip_verifier_report_digest":"e6ef4c5d1f279ffa487072d298e63fb317230b7ac4b3be7caf75f611026d1d52","purpose":"discovery","reference_contract":{"approval":null,"contract_body_digest":"2be50e9acb278252d17d4f47e90c0487f4eee93a15cf8759a9004d5594338f3a","contract_id":"reference-contract-core","contract_version":1,"observations":null,"path_policy":{"allow_user_paths":false,"allowed_root_kinds":["catia-install","windows-install","system"]},"reference_definitions":[],"status":"discovery-required","transitions":null},"release_eligible":false,"review_record_id":"record-review-7477c28","revocation_snapshot_sha256":"d1b33e9d37d0fae8db5ea5bc8b69026e7a6744536b577bbd9bfdc1b4375a4fe7","revocation_status":"active","schema_version":1,"target":"CATIA R2018/VBA7 64","upstream_cutoff":"abce8ffe37d25cc8f189ae9e9a2a1e942279a5ad","work_branch":"codex/dev-review-report","work_commit":"7477c28759fcb6a7188caba8dc5386264b90fe2b","work_tree":"c1642f2bdccee8f7ca2bd3d0bc6b5d06dfb524ae","zip_sha256":"a81d39cc596dff18e84be70f5b910f765a8538d3ed912d8d2c9aeb10cd7e327f","zip_sidecar_sha256":"7cfb3e72720720e7c74994a885c4bcbe3990b5483f0e6bb81f4389a2f424ce08"}
