{"catalog_sha256":"1ce7c253b8220c5aa53bad37f9565a21ddc013d966b878b5e4f04571ccc5f497","comparison_directory_verifier_report_digest":"e6ef4c5d1f279ffa487072d298e63fb317230b7ac4b3be7caf75f611026d1d52","comparison_zip_verifier_report_digest":"e6ef4c5d1f279ffa487072d298e63fb317230b7ac4b3be7caf75f611026d1d52","compile_status":"not-run","created_at":"2026-07-18T20:01:32Z","expires_at":"2026-07-25T19:00:38Z","fork_dev_cutoff":"abce8ffe37d25cc8f189ae9e9a2a1e942279a5ad","generation_command":"macro-menu-build create-target-handoff","handoff_id":"handoff-abb194d469d790637ab1","kit_id":"kit-1ce7c253b8220c5aa53b","manifest_digest":"d8fe08827f1babf7282e6177e6d2e9d8c9c6cdc1f201e86812e37504986f0522","manifest_sha256":"879712ca6ccba2a118c79e23b07a00ae6a28e711298d582bc49db190ec736a6a","package_id":"core","prepared_record_id":"record-prepared-957d0f2","primary_directory_verifier_report_digest":"e6ef4c5d1f279ffa487072d298e63fb317230b7ac4b3be7caf75f611026d1d52","primary_zip_verifier_report_digest":"e6ef4c5d1f279ffa487072d298e63fb317230b7ac4b3be7caf75f611026d1d52","purpose":"discovery","reference_contract":{"approval":null,"contract_body_digest":"2be50e9acb278252d17d4f47e90c0487f4eee93a15cf8759a9004d5594338f3a","contract_id":"reference-contract-core","contract_version":1,"observations":null,"path_policy":{"allow_user_paths":false,"allowed_root_kinds":["catia-install","windows-install","system"]},"reference_definitions":[],"status":"discovery-required","transitions":null},"release_eligible":false,"review_record_id":"record-review-957d0f2","revocation_snapshot_sha256":"735d333e2f492f07776bd6f78bc5e75858a28fc712065aa01737fbef300e1834","revocation_status":"active","schema_version":1,"target":"CATIA R2018/VBA7 64","upstream_cutoff":"abce8ffe37d25cc8f189ae9e9a2a1e942279a5ad","work_branch":"codex/dev-review-report","work_commit":"957d0f23c40513a9b82d583e8428d7c85d1710c5","work_tree":"fe3d79dedfeb282e5e80f8ebf0a345b927811b35","zip_sha256":"8f5b213c7194092d425959c42d4254df941cccbc4b0708568c935b542adf8544","zip_sidecar_sha256":"ec4255eb2b47095bb3c6b36925b8b8d7190ab430c1a1c4577b48cf3095349141"}
