{"catalog_sha256":"a235b5dd5fc27d09b7de5d00b811fdf105a37958801ccdbd0ac228e825e55763","comparison_directory_verifier_report_digest":"e6ef4c5d1f279ffa487072d298e63fb317230b7ac4b3be7caf75f611026d1d52","comparison_zip_verifier_report_digest":"e6ef4c5d1f279ffa487072d298e63fb317230b7ac4b3be7caf75f611026d1d52","compile_status":"not-run","created_at":"2026-07-18T15:33:27Z","expires_at":"2026-07-25T14:33:26Z","fork_dev_cutoff":"abce8ffe37d25cc8f189ae9e9a2a1e942279a5ad","generation_command":"macro-menu-build create-target-handoff","handoff_id":"handoff-be908ee37a9b5beba0b5","kit_id":"kit-a235b5dd5fc27d09b7de","manifest_digest":"d8fe08827f1babf7282e6177e6d2e9d8c9c6cdc1f201e86812e37504986f0522","manifest_sha256":"f666b8a2a41e9cb0cb421f22b5fbc4e10c45b879ab5deed88418e987bb448ad9","package_id":"core","prepared_record_id":"record-prepared-982ce2b","primary_directory_verifier_report_digest":"e6ef4c5d1f279ffa487072d298e63fb317230b7ac4b3be7caf75f611026d1d52","primary_zip_verifier_report_digest":"e6ef4c5d1f279ffa487072d298e63fb317230b7ac4b3be7caf75f611026d1d52","purpose":"discovery","reference_contract":{"approval":null,"contract_body_digest":"2be50e9acb278252d17d4f47e90c0487f4eee93a15cf8759a9004d5594338f3a","contract_id":"reference-contract-core","contract_version":1,"observations":null,"path_policy":{"allow_user_paths":false,"allowed_root_kinds":["catia-install","windows-install","system"]},"reference_definitions":[],"status":"discovery-required","transitions":null},"release_eligible":false,"review_record_id":"record-review-982ce2b","revocation_snapshot_sha256":"4f33ce6b2e07a91929563f9bb5bec6816d2a8a10782fe704284dadeb27567c7b","revocation_status":"active","schema_version":1,"target":"CATIA R2018/VBA7 64","upstream_cutoff":"abce8ffe37d25cc8f189ae9e9a2a1e942279a5ad","work_branch":"codex/dev-review-report","work_commit":"982ce2bd11ad971b9614e12d38a6830b5a7789ba","work_tree":"b4e423ac2faccbcc0c11e65e8a10917ece862c88","zip_sha256":"cee08464bf22024f733b2277e61defdf448e76f41b18082225ffb880fec7fe45","zip_sidecar_sha256":"5575207cef866ffaac6ca7202d4a69ea020c7fd9a7b7d9995a3971a00888b494"}
